{
  "version": 1,
  "package": "@afenda/design-system",
  "scope": "ui-primitives",
  "components": [
    {
      "component": "accordion",
      "sourceFile": "ui-primitives/accordion.tsx",
      "manifestFile": "ui-primitives/accordion.manifest.ts",
      "owner": "design-system",
      "lifecycle": "stable",
      "purpose": "Canonical governance metadata for the accordion primitive.",
      "fixtures": [],
      "exports": [
        "Accordion",
        "AccordionContent",
        "AccordionItem",
        "AccordionTrigger"
      ],
      "dataSlots": [
        "accordion",
        "accordion-content",
        "accordion-item",
        "accordion-trigger"
      ],
      "forwardRef": false,
      "classSignals": {
        "usesCva": false,
        "usesCn": true,
        "hasTokenClasses": true,
        "hasRawPaletteClasses": false,
        "hasArbitraryColorClasses": false,
        "hasInlineStyleAttribute": false
      },
      "cvaDefinitionCount": 0
    },
    {
      "component": "alert",
      "sourceFile": "ui-primitives/alert.tsx",
      "manifestFile": "ui-primitives/alert.manifest.ts",
      "owner": "design-system",
      "lifecycle": "stable",
      "purpose": "Canonical governance metadata for the alert primitive.",
      "fixtures": [],
      "exports": [
        "Alert",
        "AlertDescription",
        "AlertTitle"
      ],
      "dataSlots": [
        "alert",
        "alert-description",
        "alert-title"
      ],
      "forwardRef": false,
      "classSignals": {
        "usesCva": true,
        "usesCn": true,
        "hasTokenClasses": true,
        "hasRawPaletteClasses": false,
        "hasArbitraryColorClasses": false,
        "hasInlineStyleAttribute": false
      },
      "cvaDefinitionCount": 1
    },
    {
      "component": "alert-dialog",
      "sourceFile": "ui-primitives/alert-dialog.tsx",
      "manifestFile": "ui-primitives/alert-dialog.manifest.ts",
      "owner": "design-system",
      "lifecycle": "stable",
      "purpose": "Canonical governance metadata for the alert-dialog primitive.",
      "fixtures": [],
      "exports": [
        "AlertDialog",
        "AlertDialogAction",
        "AlertDialogCancel",
        "AlertDialogContent",
        "AlertDialogDescription",
        "AlertDialogFooter",
        "AlertDialogHeader",
        "AlertDialogMedia",
        "AlertDialogOverlay",
        "AlertDialogPortal",
        "AlertDialogTitle",
        "AlertDialogTrigger"
      ],
      "dataSlots": [
        "alert-dialog",
        "alert-dialog-action",
        "alert-dialog-cancel",
        "alert-dialog-content",
        "alert-dialog-description",
        "alert-dialog-footer",
        "alert-dialog-header",
        "alert-dialog-media",
        "alert-dialog-overlay",
        "alert-dialog-portal",
        "alert-dialog-title",
        "alert-dialog-trigger"
      ],
      "forwardRef": false,
      "classSignals": {
        "usesCva": false,
        "usesCn": true,
        "hasTokenClasses": true,
        "hasRawPaletteClasses": false,
        "hasArbitraryColorClasses": false,
        "hasInlineStyleAttribute": false
      },
      "cvaDefinitionCount": 0
    },
    {
      "component": "aspect-ratio",
      "sourceFile": "ui-primitives/aspect-ratio.tsx",
      "manifestFile": "ui-primitives/aspect-ratio.manifest.ts",
      "owner": "design-system",
      "lifecycle": "stable",
      "purpose": "Canonical governance metadata for the aspect-ratio primitive.",
      "fixtures": [],
      "exports": [
        "AspectRatio"
      ],
      "dataSlots": [
        "aspect-ratio"
      ],
      "forwardRef": false,
      "classSignals": {
        "usesCva": false,
        "usesCn": false,
        "hasTokenClasses": false,
        "hasRawPaletteClasses": false,
        "hasArbitraryColorClasses": false,
        "hasInlineStyleAttribute": false
      },
      "cvaDefinitionCount": 0
    },
    {
      "component": "avatar",
      "sourceFile": "ui-primitives/avatar.tsx",
      "manifestFile": "ui-primitives/avatar.manifest.ts",
      "owner": "design-system",
      "lifecycle": "stable",
      "purpose": "Canonical governance metadata for the avatar primitive.",
      "fixtures": [],
      "exports": [
        "Avatar",
        "AvatarBadge",
        "AvatarFallback",
        "AvatarGroup",
        "AvatarGroupCount",
        "AvatarImage"
      ],
      "dataSlots": [
        "avatar",
        "avatar-badge",
        "avatar-fallback",
        "avatar-group",
        "avatar-group-count",
        "avatar-image"
      ],
      "forwardRef": false,
      "classSignals": {
        "usesCva": false,
        "usesCn": true,
        "hasTokenClasses": true,
        "hasRawPaletteClasses": false,
        "hasArbitraryColorClasses": false,
        "hasInlineStyleAttribute": false
      },
      "cvaDefinitionCount": 0
    },
    {
      "component": "badge",
      "sourceFile": "ui-primitives/badge.tsx",
      "manifestFile": "ui-primitives/badge.manifest.ts",
      "owner": "design-system",
      "lifecycle": "stable",
      "purpose": "Canonical governance metadata for the badge primitive.",
      "fixtures": [],
      "exports": [
        "Badge",
        "badgeVariants"
      ],
      "dataSlots": [
        "badge"
      ],
      "forwardRef": false,
      "classSignals": {
        "usesCva": true,
        "usesCn": true,
        "hasTokenClasses": true,
        "hasRawPaletteClasses": false,
        "hasArbitraryColorClasses": false,
        "hasInlineStyleAttribute": false
      },
      "cvaDefinitionCount": 1
    },
    {
      "component": "breadcrumb",
      "sourceFile": "ui-primitives/breadcrumb.tsx",
      "manifestFile": "ui-primitives/breadcrumb.manifest.ts",
      "owner": "design-system",
      "lifecycle": "stable",
      "purpose": "Canonical governance metadata for the breadcrumb primitive.",
      "fixtures": [],
      "exports": [
        "Breadcrumb",
        "BreadcrumbEllipsis",
        "BreadcrumbItem",
        "BreadcrumbLink",
        "BreadcrumbList",
        "BreadcrumbPage",
        "BreadcrumbSeparator"
      ],
      "dataSlots": [
        "breadcrumb",
        "breadcrumb-ellipsis",
        "breadcrumb-item",
        "breadcrumb-link",
        "breadcrumb-list",
        "breadcrumb-page",
        "breadcrumb-separator"
      ],
      "forwardRef": false,
      "classSignals": {
        "usesCva": false,
        "usesCn": true,
        "hasTokenClasses": true,
        "hasRawPaletteClasses": false,
        "hasArbitraryColorClasses": false,
        "hasInlineStyleAttribute": false
      },
      "cvaDefinitionCount": 0
    },
    {
      "component": "button",
      "sourceFile": "ui-primitives/button.tsx",
      "manifestFile": "ui-primitives/button.manifest.ts",
      "owner": "design-system",
      "lifecycle": "stable",
      "purpose": "Canonical governance metadata for the button primitive.",
      "fixtures": [],
      "exports": [
        "Button",
        "buttonVariants"
      ],
      "dataSlots": [
        "button"
      ],
      "forwardRef": false,
      "classSignals": {
        "usesCva": true,
        "usesCn": true,
        "hasTokenClasses": true,
        "hasRawPaletteClasses": false,
        "hasArbitraryColorClasses": false,
        "hasInlineStyleAttribute": false
      },
      "cvaDefinitionCount": 1
    },
    {
      "component": "button-group",
      "sourceFile": "ui-primitives/button-group.tsx",
      "manifestFile": "ui-primitives/button-group.manifest.ts",
      "owner": "design-system",
      "lifecycle": "stable",
      "purpose": "Canonical governance metadata for the button-group primitive.",
      "fixtures": [],
      "exports": [
        "ButtonGroup",
        "ButtonGroupSeparator",
        "ButtonGroupText",
        "buttonGroupVariants"
      ],
      "dataSlots": [
        "button-group",
        "button-group-separator"
      ],
      "forwardRef": false,
      "classSignals": {
        "usesCva": true,
        "usesCn": true,
        "hasTokenClasses": true,
        "hasRawPaletteClasses": false,
        "hasArbitraryColorClasses": false,
        "hasInlineStyleAttribute": false
      },
      "cvaDefinitionCount": 1
    },
    {
      "component": "calendar",
      "sourceFile": "ui-primitives/calendar.tsx",
      "manifestFile": "ui-primitives/calendar.manifest.ts",
      "owner": "design-system",
      "lifecycle": "stable",
      "purpose": "Canonical governance metadata for the calendar primitive.",
      "fixtures": [],
      "exports": [
        "Calendar",
        "CalendarDayButton"
      ],
      "dataSlots": [
        "calendar"
      ],
      "forwardRef": false,
      "classSignals": {
        "usesCva": false,
        "usesCn": true,
        "hasTokenClasses": true,
        "hasRawPaletteClasses": false,
        "hasArbitraryColorClasses": false,
        "hasInlineStyleAttribute": false
      },
      "cvaDefinitionCount": 0
    },
    {
      "component": "card",
      "sourceFile": "ui-primitives/card.tsx",
      "manifestFile": "ui-primitives/card.manifest.ts",
      "owner": "design-system",
      "lifecycle": "stable",
      "purpose": "Canonical governance metadata for the card primitive.",
      "fixtures": [],
      "exports": [
        "Card",
        "CardAction",
        "CardContent",
        "CardDescription",
        "CardFooter",
        "CardHeader",
        "CardTitle"
      ],
      "dataSlots": [
        "card",
        "card-action",
        "card-content",
        "card-description",
        "card-footer",
        "card-header",
        "card-title"
      ],
      "forwardRef": false,
      "classSignals": {
        "usesCva": false,
        "usesCn": true,
        "hasTokenClasses": true,
        "hasRawPaletteClasses": false,
        "hasArbitraryColorClasses": false,
        "hasInlineStyleAttribute": false
      },
      "cvaDefinitionCount": 0
    },
    {
      "component": "carousel",
      "sourceFile": "ui-primitives/carousel.tsx",